{"candidate_id":"rk2-0.2.0","candidate_version":"0.2.0","source_commit":"7bad9e18b507a3fc8a66d80c9d25d1578b7155ea","candidate_manifest_sha256":"325b220b89a3d8952ea863cb0fab7084cf3c36872e74855fc3540528913edfff","kernel_sha256":"b23a87ddac73658f7191c5682182d83a379556520e7d08935b064e50b4d7d31a","module_manifest_sha256":"43519725b79fe5d6872766eb5d053176714a37844bc69215b5a5ba0c9dbe057c","covered_files":[{"repository_relative_path":"adapters/generic/SYSTEM.md","sha256":"15cb7d805605f4a7326bbad925be89c7d5000e389677757e16cc7c447b42b251","bytes":1450,"role":"adapter","module_id":null},{"repository_relative_path":"core/candidate-manifest.schema.json","sha256":"d420da01f494d2606162bee3568288a5b40d96b9111609a46b196d5b7a38f30c","bytes":2256,"role":"candidate_schema","module_id":null},{"repository_relative_path":"core/computer-use-policy.md","sha256":"59f95edbe7fd1e4ce0c51324334776979e033a31f9c7ab7b084f50670c5b0cda","bytes":1763,"role":"loadable_module","module_id":"core.computer-use-policy"},{"repository_relative_path":"core/module-registry.json","sha256":"43519725b79fe5d6872766eb5d053176714a37844bc69215b5a5ba0c9dbe057c","bytes":1680,"role":"module_registry","module_id":null},{"repository_relative_path":"core/specialist-gate.md","sha256":"209a78d885cae1c44287ece554cc7458e03a866ccde5b7fb05a2ce6aedd94914","bytes":4069,"role":"specialist_gate","module_id":null},{"repository_relative_path":"core/telemetry.schema.json","sha256":"be5f08ce84a21bf042469bd9b4ed43b2d2a3285a94611c2ae662a573c09315f8","bytes":17029,"role":"telemetry_schema","module_id":null},{"repository_relative_path":"core/tiny-kernel.md","sha256":"b23a87ddac73658f7191c5682182d83a379556520e7d08935b064e50b4d7d31a","bytes":1307,"role":"kernel","module_id":null},{"repository_relative_path":"dist/v0.2/reasonkit-kernel.md","sha256":"b23a87ddac73658f7191c5682182d83a379556520e7d08935b064e50b4d7d31a","bytes":1307,"role":"generated_artifact","module_id":null},{"repository_relative_path":"evals/benchmark-v0.2.json","sha256":"274353d456828311f34eaaeccc3682edc70b37e2983689cccd8119beb8bb856b","bytes":10953,"role":"other","module_id":null},{"repository_relative_path":"evals/creative/fixtures/task-002/acceptance.md","sha256":"7f3da9a71c6b8f0011e4be19b80f954886c45e4574942a33cedce56d07ef9c61","bytes":615,"role":"other","module_id":null},{"repository_relative_path":"evals/creative/fixtures/task-002/app/globals.css","sha256":"ef4e25fb0e5a3b098081f726a3f07688d6e1dcb2376db9ab795a4f29a4b5ff7c","bytes":1895,"role":"other","module_id":null},{"repository_relative_path":"evals/creative/fixtures/task-002/app/layout.js","sha256":"30cfd2233c6d992af2457af0cd68502c0db945346f0138307817e3e4d2164640","bytes":299,"role":"other","module_id":null},{"repository_relative_path":"evals/creative/fixtures/task-002/app/page.js","sha256":"3ec1f718a29cdcd72be353792e8f8043d609bdc5ee7539b72ffd43dcbb18b554","bytes":1010,"role":"other","module_id":null},{"repository_relative_path":"evals/creative/fixtures/task-002/content.json","sha256":"ac7b946d01bff5446b37d7fb902ac4b966059459040deddf4bf6629418dd2974","bytes":650,"role":"other","module_id":null},{"repository_relative_path":"evals/creative/fixtures/task-002/package.json","sha256":"a9a227d5cdb5cab81627593cba9349348f255c7c963020fbb7d6458b81d52bff","bytes":316,"role":"other","module_id":null},{"repository_relative_path":"evals/creative/fixtures/task-002/public/mark.svg","sha256":"f8be72938910ac8ab57b520fe224cf0fc1d08b6bdaee18a098f4c0125f410b77","bytes":299,"role":"other","module_id":null},{"repository_relative_path":"evals/creative/fixtures/task-002/public/README.md","sha256":"2162065bdd57ccc241d62fccce6d2b590a01a6a8a2edfe5e75014db163c6e733","bytes":148,"role":"other","module_id":null},{"repository_relative_path":"evals/creative/TASK-002.md","sha256":"3c67e875f0628f1b34d734653862119d0a9b4502ed66672cca133f848ef2d2a2","bytes":2275,"role":"other","module_id":null},{"repository_relative_path":"evals/debugging/evaluator-only/TASK-003/hidden-concurrency-regression.js","sha256":"fa0c9b0e62be6a5c3b1d60c0878730be4d2ceb62a641a715444951604708edef","bytes":2025,"role":"other","module_id":null},{"repository_relative_path":"evals/debugging/evaluator-only/TASK-003/reference-fixed/src/idempotency.js","sha256":"f7459aed8bdb1d9554de2b74793757dad58264d74df5bed3475c25ac1d86798e","bytes":646,"role":"other","module_id":null},{"repository_relative_path":"evals/debugging/evaluator-only/TASK-003/reference-fixed/src/queue.js","sha256":"cd6eae0d6698999dc6c056bdaf3fcf8ea90b0e6749af79717ba43726e75d6135","bytes":1226,"role":"other","module_id":null},{"repository_relative_path":"evals/debugging/evaluator-only/TASK-003/reference-fixed/src/repository.js","sha256":"c979f5c6f1014fcd7a6725c2d96ffe2b046500d2f8367fccc6665f097d34a69e","bytes":767,"role":"other","module_id":null},{"repository_relative_path":"evals/debugging/evaluator-only/TASK-003/reference-fixed/src/transaction.js","sha256":"082cf82902dbea83560bd68585e6a01d9367736015ce91da63540d4bf33f0085","bytes":594,"role":"other","module_id":null},{"repository_relative_path":"evals/debugging/evaluator-only/TASK-003/reference-fixed/src/worker.js","sha256":"23cb14af7dc31baeec6f3730eb019a362ad82c80b6d3cf315c0786c2c6951117","bytes":1381,"role":"other","module_id":null},{"repository_relative_path":"evals/debugging/evaluator-only/TASK-003/verify-task-003.ps1","sha256":"be84d8fff21e302fcd6d76dfd1cf02c5886a155d5bd8f0e8c9128366dc7b47b1","bytes":969,"role":"other","module_id":null},{"repository_relative_path":"evals/debugging/fixtures/task-001/parser.js","sha256":"b5904d98c0236d3aa0f2530dda970d7df53b2d28ed5c2218716a184ada9ab4ad","bytes":383,"role":"other","module_id":null},{"repository_relative_path":"evals/debugging/fixtures/task-001/parser.test.js","sha256":"ff720ce4ae79df831e36b1d520749dba2502711e4d84eb4b077c8d7359f66cd2","bytes":490,"role":"other","module_id":null},{"repository_relative_path":"evals/debugging/fixtures/task-003/fixtures/jobs.json","sha256":"4764b9b94c77f57938a7e7e240e57a0346d16532bb3b41c45b9bc5754ad18f21","bytes":286,"role":"other","module_id":null},{"repository_relative_path":"evals/debugging/fixtures/task-003/logs/README.md","sha256":"a34acae3bb17305890258fa86661c6cdfaae5a1db84b774f907f8183f0163229","bytes":353,"role":"other","module_id":null},{"repository_relative_path":"evals/debugging/fixtures/task-003/logs/retry.log","sha256":"65334d529451a89a44eff788e3d89e96624aef080f67b9e6b1a6c1e535499686","bytes":347,"role":"other","module_id":null},{"repository_relative_path":"evals/debugging/fixtures/task-003/logs/worker.log","sha256":"3f9ba176dc12dd171cf01ca0a9b49c654c35f02b714c135eddf08453d9ee7655","bytes":1221,"role":"other","module_id":null},{"repository_relative_path":"evals/debugging/fixtures/task-003/package.json","sha256":"1508d475494d01d9f04ee4855e2fc479fe4ea03b55c0c111c8fedcf61e6da4c3","bytes":213,"role":"other","module_id":null},{"repository_relative_path":"evals/debugging/fixtures/task-003/src/idempotency.js","sha256":"b9cc9a5deb096a31e9d1d4e4cc51dd2e82ba99c1fe4b9fb4bfbe348cfc3e0152","bytes":426,"role":"other","module_id":null},{"repository_relative_path":"evals/debugging/fixtures/task-003/src/queue.js","sha256":"d6ea7dc08aa149cfd32de277fc3b2a36ffd8ed73c7ea09501db55342c93a66e9","bytes":1230,"role":"other","module_id":null},{"repository_relative_path":"evals/debugging/fixtures/task-003/src/repository.js","sha256":"1b4c43c56b952f9a0ce3a55d87100bc509222b83a93307a636d606811b1e72d6","bytes":789,"role":"other","module_id":null},{"repository_relative_path":"evals/debugging/fixtures/task-003/src/transaction.js","sha256":"082cf82902dbea83560bd68585e6a01d9367736015ce91da63540d4bf33f0085","bytes":594,"role":"other","module_id":null},{"repository_relative_path":"evals/debugging/fixtures/task-003/src/worker.js","sha256":"59785faf7aed22cdd398812b11a587f5f45046edf7f8967913cfef4af4541502","bytes":1134,"role":"other","module_id":null},{"repository_relative_path":"evals/debugging/fixtures/task-003/tests/concurrency.test.js","sha256":"7b4316cf3abe4388ccadbf4c5075df9fe58032df7ca42737d6be950231a83dd0","bytes":1069,"role":"other","module_id":null},{"repository_relative_path":"evals/debugging/fixtures/task-003/tests/retry.test.js","sha256":"19eb0058fd78e2bb881953beed252fbae0f2e5741eb3e54349c223b9d4259285","bytes":1063,"role":"other","module_id":null},{"repository_relative_path":"evals/debugging/fixtures/task-003/tests/worker.test.js","sha256":"4c74a1ab0e58d670cd264f012aff172ef13f288c0c8a2dd4b658531a0e87d8fe","bytes":1171,"role":"other","module_id":null},{"repository_relative_path":"evals/debugging/TASK-001.md","sha256":"e857532205e543bbfb2585035c7b6cfe164b08b4aba4f958b5308f6f5fb6756a","bytes":1336,"role":"other","module_id":null},{"repository_relative_path":"evals/debugging/TASK-003.acceptance.md","sha256":"4ee526a7f9ce1c50853dbc739cfae909fb9c30d65ade6d30628dad8d32b4bcce","bytes":1243,"role":"other","module_id":null},{"repository_relative_path":"evals/debugging/TASK-003.md","sha256":"3da482fa15a8ef0a15b997a8f48009fc52d38324fb983ce6866d48b8da0f2fce","bytes":1308,"role":"other","module_id":null},{"repository_relative_path":"protocols/architecture.md","sha256":"2077081286fc638c9db54c1f0c8afe77e798b00b09f564799052ea5ff16640f2","bytes":1050,"role":"loadable_module","module_id":"protocol.architecture"},{"repository_relative_path":"protocols/coding.md","sha256":"6bba9439fe3a4c0e24a3a22bd379e53ea164f4fa74f9d2309bd9fc79c38cc01b","bytes":880,"role":"loadable_module","module_id":"protocol.coding"},{"repository_relative_path":"protocols/computer-use.md","sha256":"bef03d45499330183d49739356f37101a77961e7743fd31c07fb9a8ebd3092b9","bytes":909,"role":"loadable_module","module_id":"protocol.computer-use"},{"repository_relative_path":"protocols/debugging.md","sha256":"de15149fc362bc1b66ddb354a1a36be1853ed504b80e2ba4f5ff2d5fa7f4b766","bytes":954,"role":"loadable_module","module_id":"protocol.debugging"},{"repository_relative_path":"protocols/design.md","sha256":"f319108a6cfd60f5b5e8c862d32d57f37cc21268d84b280c72b1569b94c09bba","bytes":1248,"role":"loadable_module","module_id":"p